{
  "schema": "social_post/v1",
  "slug": "openai-codex-pr-27414",
  "channel": "x",
  "target_account": "decodexspace",
  "controller_account": "hackink",
  "mode": "operator_impact",
  "status": "published",
  "audience": "Codex MCP and app-server operators",
  "text": [
    "Codex now preserves `enabled = false` for MCP servers after runtime and extension overlays. That matters for operators who disable `codex_apps` or same-name MCP servers and expect overlays not to re-enable them. PR: https://github.com/openai/codex/pull/27414"
  ],
  "source_refs": {
    "social_candidates": [
      "artifacts/github/social-candidates/openai-codex-pr-27414.json"
    ],
    "reservations": [
      "artifacts/social/x/reservations/2026-06-11/openai-codex-pr-27414.json"
    ],
    "upstream_reviews": [
      "artifacts/github/reviews/openai-codex-pr-27414.review.json"
    ],
    "upstream_impacts": [
      "artifacts/github/impact/openai-codex-pr-27414.json"
    ],
    "urls": [
      "https://github.com/openai/codex/pull/27414",
      "https://x.com/decodexspace/status/2065102249202942181"
    ]
  },
  "evidence_notes": [
    "The social_candidate/v1 artifact has decision.worthiness = publish, priority critical, and mode operator_impact for openai-codex-pr-27414.",
    "The upstream_review/v1 artifact confirms PR #27414 preserves configured enabled = false MCP servers after runtime fallback and extension overlays.",
    "The upstream_impact/v1 artifact marks the change as public_signal_decision publish, control_plane_impact compat_risk, and publisher_angle operator_impact.",
    "The x-post-quality-system gate passed because the post states what changed, who can act on it, and the direct source that proves it; the checked copy is 258 characters and includes a direct GitHub PR URL.",
    "Checked durable social_post/v1 records contained no published or blocked record for this idempotency key before publication.",
    "Checked durable social_publish_reservation/v1 records contained no active reservation for this idempotency key before the new reservation was created.",
    "Open GitHub PR readback with routed hackink credentials found pending publication PR #328 for openai-codex-app-26-608 and PR #298 for openai-codex-pr-26486, with no open PR touching openai-codex-pr-27414.",
    "PR #336 made the active reservation visible before X compose; the PR diff was limited to artifacts/social/x/reservations/2026-06-11/openai-codex-pr-27414.json at reservation time.",
    "Chrome account readback initially showed @hackink active with @decodexspace available; the automation switched to @decodexspace and verified owner controls on the @decodexspace profile before reservation and compose.",
    "Live @decodexspace profile readback before reservation was readable and found no PR 27414 lead text, PR number, or source URL across bounded rendered profile posts; focused X search also found no match.",
    "Live @decodexspace profile readback after PR-visible reservation and immediately before clicking Post again found no PR 27414 lead text, PR number, or source URL across bounded rendered profile posts; focused X search also found no match.",
    "The compose dialog showed @decodexspace and the 258-character checked text before the enabled modal Post button was clicked.",
    "Home timeline readback immediately after posting showed the new @decodexspace status with the expected PR 27414 MCP overlay text and GitHub source card.",
    "Permalink readback showed the expected @decodexspace post text, Automated by @hackink attribution, GitHub PR #27414 card, and no attached image media or /photo/N link.",
    "The status ID decodes to 2026-06-11T16:01:58.611Z.",
    "After publication, cap accounting review found the checked-in openai-codex-rust-v0-139-0-release-rollup record counted a seven-post thread with daily_count_after = 8, and open PR #328 counted openai-codex-app-26-608 as daily_count_before = 9 and daily_count_after = 10. This record preserves the live publication and the cap-accounting blocker for operator review instead of treating the PR as landable."
  ],
  "claims": [
    {
      "text": "Configured disabled MCP servers remain disabled after runtime overlays.",
      "evidence": "artifacts/github/reviews/openai-codex-pr-27414.review.json",
      "confidence": "confirmed"
    },
    {
      "text": "The regression-covered example is a disabled codex_apps server.",
      "evidence": "artifacts/github/impact/openai-codex-pr-27414.json",
      "confidence": "confirmed"
    },
    {
      "text": "The PR #27414 operator-impact post is live on @decodexspace.",
      "evidence": "https://x.com/decodexspace/status/2065102249202942181",
      "confidence": "confirmed"
    }
  ],
  "decision": {
    "worthiness": "publish",
    "priority": "critical",
    "idempotency_key": "x:decodexspace:openai-codex-pr-27414:operator_impact",
    "reason": "The PR fixes an operator-visible MCP safety boundary with clear source evidence.",
    "daily_limit": 8,
    "daily_count_before": 10,
    "daily_count_after": 11,
    "day": "2026-06-11",
    "timezone": "Asia/Shanghai"
  },
  "publication": {
    "posted_at": "2026-06-11T16:01:58.611Z",
    "published_urls": [
      "https://x.com/decodexspace/status/2065102249202942181"
    ],
    "publisher": "chrome",
    "account_verified": true,
    "made_with_ai": false
  },
  "media_refs": [
    "media_caveat: no generated media was attached; this non-release operator_impact post remains valuable text-only because the source-backed MCP safety note and GitHub PR card are the reader value."
  ],
  "caveats": [
    "Do not imply all MCP overlay precedence changed.",
    "Keep codex_apps framed as the regression-covered example.",
    "No generated image was used because this was a single non-release operator-impact post with sufficient reader value from the text and source card.",
    "Cap accounting was discovered inconsistent after publication; this PR must not be landed automatically until the operator decides whether to keep, delete, or supersede the live post and how to reconcile June 11 social records."
  ],
  "post_lifecycle": {
    "current_state": "live",
    "quote_eligible": false,
    "reason": "This is a standalone operator-impact post, not a prerelease quote-chain anchor."
  }
}
